{
  "schema": "qlab.genome/1.0",
  "market": {"symbol": "XAUUSD", "timeframe": "M5"},
  "entry": {
    "long": {"id": "n1", "op": "and", "children": [
      {"id": "n2", "op": "or", "children": [
        {"id": "n3", "op": "event", "ref": {"feature": "judas", "params": {"sweep_atr": 0.1}, "output": "judas_bull"}},
        {"id": "n4", "op": "event", "ref": {"feature": "mitigation", "params": {"left": 3, "right": 3, "lookback": 10, "expiry": 150}, "output": "bull_retest"}}
      ]},
      {"id": "n5", "op": "event", "ref": {"feature": "smt", "params": {"ref": "XAGUSD", "lookback": 20}, "output": "bull"}}
    ]},
    "short": {"id": "n6", "op": "and", "children": [
      {"id": "n7", "op": "event", "ref": {"feature": "po3", "params": {"manip_atr": 0.5}, "output": "po3_bear"}},
      {"id": "n8", "op": "event", "ref": {"feature": "judas", "params": {"sweep_atr": 0.1}, "output": "judas_bear"}}
    ]}
  },
  "exit": {"stop": {"type": "atr", "period": 14, "mult": 2.0}, "target": {"type": "rr", "rr": 2.0},
           "break_even": null, "trailing": null, "time_stop_bars": 96, "exit_on_opposite": false},
  "sizing": {"risk_pct": 0.5},
  "management": {"max_trades_per_day": 2, "cooldown_bars": 3}
}
