{
  "schema": "qlab.genome/1.0",
  "market": {"symbol": "XAUUSD", "timeframe": "M15"},
  "entry": {
    "long": {"id": "n1", "op": "and", "children": [
      {"id": "n2", "op": "compare", "left": {"feature": "ema", "params": {"period": 20}, "output": "value"},
       "cmp": "cross_above", "right": {"feature": "ema", "params": {"period": 50}, "output": "value"}},
      {"id": "n3", "op": "compare", "left": {"feature": "rsi", "params": {"period": 14}, "output": "value"},
       "cmp": "gt", "right": {"const": 50}},
      {"id": "n4", "op": "event", "ref": {"feature": "session", "params": {"name": "london"}, "output": "active"}}
    ]},
    "short": {"id": "n5", "op": "and", "children": [
      {"id": "n6", "op": "compare", "left": {"feature": "ema", "params": {"period": 20}, "output": "value"},
       "cmp": "cross_below", "right": {"feature": "ema", "params": {"period": 50}, "output": "value"}},
      {"id": "n7", "op": "compare", "left": {"feature": "rsi", "params": {"period": 14}, "output": "value"},
       "cmp": "lt", "right": {"const": 50}},
      {"id": "n8", "op": "event", "ref": {"feature": "session", "params": {"name": "london"}, "output": "active"}}
    ]}
  },
  "exit": {"stop": {"type": "atr", "period": 14, "mult": 2.0}, "target": {"type": "rr", "rr": 2.0},
           "break_even": {"at_r": 1.0}, "trailing": null, "time_stop_bars": 96, "exit_on_opposite": false},
  "sizing": {"risk_pct": 0.5},
  "management": {"max_trades_per_day": 3, "cooldown_bars": 2}
}
